<!DOCTYPE VNCLASS SYSTEM "vn_class-3.dtd">
<VNCLASS ID="stalk-35.3" xmlns:xsi="http://www.w3.org/2001/XMLSchema-instance" xsi:noNamespaceSchemaLocation="vn_schema-3.xsd">
 <MEMBERS>
  <MEMBER fn_mapping="None" grouping="scent.02" name="scent" verbnet_key="scent#3" wn="scent%2:39:01" features=""/>
  <MEMBER fn_mapping="Perception_experience" grouping="smell.01" name="smell" verbnet_key="smell#4" wn="smell%2:39:01" features=""/>
  <MEMBER fn_mapping="Cotheme" grouping="stalk.01" name="stalk" verbnet_key="stalk#2" wn="stalk%2:38:03" features=""/>
  <MEMBER fn_mapping="None" grouping="taste.02" name="taste" verbnet_key="taste#4" wn="taste%2:34:00" features=""/>
  <MEMBER fn_mapping="None" grouping="track.02" name="track" verbnet_key="track#2" wn="track%2:38:00" features=""/>
  <MEMBER fn_mapping="None" grouping="whiff.01" name="whiff" verbnet_key="whiff#2" wn="whiff%2:39:00" features=""/>
 </MEMBERS>
 <THEMROLES>
  <THEMROLE type="Agent">
   <SELRESTRS>
    <SELRESTR Value="+" type="animate"/>
   </SELRESTRS>
  </THEMROLE>
  <THEMROLE type="Theme">
   <SELRESTRS/>
  </THEMROLE>
  <THEMROLE type="Location">
   <SELRESTRS/>
  </THEMROLE>
 </THEMROLES>
 <FRAMES>
  <FRAME>
   <DESCRIPTION descriptionNumber="0.2" primary="NP V NP PP.theme" secondary="NP-PP; Theme-PP" xtag=""/>
   <EXAMPLES>
    <EXAMPLE>
     I stalked the woods for game.
    </EXAMPLE>
   </EXAMPLES>
   <SYNTAX>
    <NP value="Agent">
     <SELRESTRS/>
    </NP>
    <VERB/>
    <NP value="Location">
     <SELRESTRS/>
    </NP>
    <PREP value="for">
     <SELRESTRS/>
    </PREP>
    <NP value="Theme">
     <SELRESTRS/>
    </NP>
   </SYNTAX>
   <SEMANTICS>
    <PRED value="search">
     <ARGS>
      <ARG type="Event" value="ë"/>
      <ARG type="ThemRole" value="Agent"/>
      <ARG type="ThemRole" value="Location"/>
      <ARG type="ThemRole" value="Theme"/>
     </ARGS>
    </PRED>
   </SEMANTICS>
  </FRAME>
  <FRAME>
   <DESCRIPTION descriptionNumber="0.2" primary="NP V NP PP.location" secondary="NP-PP; Location-PP" xtag=""/>
   <EXAMPLES>
    <EXAMPLE>
     I stalked game in the woods.
    </EXAMPLE>
   </EXAMPLES>
   <SYNTAX>
    <NP value="Agent">
     <SELRESTRS/>
    </NP>
    <VERB/>
    <NP value="Theme">
     <SELRESTRS/>
    </NP>
    <PREP>
     <SELRESTRS>
      <SELRESTR Value="+" type="loc"/>
     </SELRESTRS>
    </PREP>
    <NP value="Location">
     <SELRESTRS/>
    </NP>
   </SYNTAX>
   <SEMANTICS>
    <PRED value="search">
     <ARGS>
      <ARG type="Event" value="ë"/>
      <ARG type="ThemRole" value="Agent"/>
      <ARG type="ThemRole" value="Location"/>
      <ARG type="ThemRole" value="Theme"/>
     </ARGS>
    </PRED>
   </SEMANTICS>
  </FRAME>
  <FRAME>
   <DESCRIPTION descriptionNumber="" primary="NP V NP" secondary="Transitive" xtag=""/>
   <EXAMPLES>
    <EXAMPLE>
     I tracked prints.
    </EXAMPLE>
   </EXAMPLES>
   <SYNTAX>
    <NP value="Agent">
     <SELRESTRS/>
    </NP>
    <VERB/>
    <NP value="Theme">
     <SELRESTRS/>
    </NP>
   </SYNTAX>
   <SEMANTICS>
    <PRED value="search">
     <ARGS>
      <ARG type="Event" value="ë"/>
      <ARG type="ThemRole" value="Agent"/>
      <ARG type="ThemRole" value="?Location"/>
      <ARG type="ThemRole" value="Theme"/>
     </ARGS>
    </PRED>
   </SEMANTICS>
  </FRAME>
 </FRAMES>
 <SUBCLASSES/>
</VNCLASS>