<!DOCTYPE VNCLASS SYSTEM "vn_class-3.dtd">
<VNCLASS ID="bully-59.5" xmlns:xsi="http://www.w3.org/2001/XMLSchema-instance" xsi:noNamespaceSchemaLocation="vn_schema-3.xsd">
 <MEMBERS>
  <MEMBER fn_mapping="None" grouping="" name="annoy" verbnet_key="annoy#2" wn="annoy%2:37:00" features=""/>
  <MEMBER fn_mapping="None" grouping="" name="badger" verbnet_key="badger#1" wn="badger%2:32:00" features=""/>
  <MEMBER fn_mapping="None" grouping="" name="bait" verbnet_key="bait#2" wn="bait%2:41:00" features=""/>
  <MEMBER fn_mapping="None" grouping="" name="bullock" verbnet_key="bullock#1" wn="" features=""/>
  <MEMBER fn_mapping="None" grouping="bully.01" name="bully" verbnet_key="bully#1" wn="bully%2:32:00" features=""/>
  <MEMBER fn_mapping="None" grouping="frighten.01" name="frighten" verbnet_key="frighten#2" wn="frighten%2:37:00" features=""/>
  <MEMBER fn_mapping="None" grouping="goad.01" name="goad" verbnet_key="goad#1" wn="goad%2:37:00 goad%2:35:00 goad%2:35:01 goad%2:32:01" features=""/>
  <MEMBER fn_mapping="None" grouping="harass.01 harass.02" name="harass" verbnet_key="harass#2" wn="harass%2:37:00 harass%2:33:00" features=""/>
  <MEMBER fn_mapping="None" grouping="" name="harry" verbnet_key="harry#1" wn="harry%2:37:00" features=""/>
  <MEMBER fn_mapping="None" grouping="" name="hustle" verbnet_key="hustle#1" wn="hustle%2:32:00" features=""/>
  <MEMBER fn_mapping="None" grouping="" name="nag" verbnet_key="nag#1" wn="" features=""/>
  <MEMBER fn_mapping="None" grouping="panic.01" name="panic" verbnet_key="panic#1" wn="panic%2:37:01" features=""/>
  <MEMBER fn_mapping="None" grouping="" name="shame" verbnet_key="shame#2" wn="shame%2:41:01" features=""/>
  <MEMBER fn_mapping="None" grouping="shock.01" name="shock" verbnet_key="shock#2" wn="shock%2:37:01" features=""/>
  <MEMBER fn_mapping="None" grouping="" name="taunt" verbnet_key="taunt#1" wn="" features=""/>
  <MEMBER fn_mapping="None" grouping="tease.01" name="tease" verbnet_key="tease#2" wn="tease%2:37:00 tease%2:32:00" features=""/>
  <MEMBER fn_mapping="None" grouping="" name="terrify" verbnet_key="terrify#2" wn="terrify%2:37:00" features=""/>
 </MEMBERS>
 <THEMROLES>
  <THEMROLE type="Agent">
   <SELRESTRS logic="or">
    <SELRESTR Value="+" type="animate"/>
    <SELRESTR Value="+" type="organization"/>
   </SELRESTRS>
  </THEMROLE>
  <THEMROLE type="Patient">
   <SELRESTRS logic="or">
    <SELRESTR Value="+" type="animate"/>
    <SELRESTR Value="+" type="organization"/>
   </SELRESTRS>
  </THEMROLE>
  <THEMROLE type="Result">
   <SELRESTRS/>
  </THEMROLE>
 </THEMROLES>
 <FRAMES>
  <FRAME>
   <DESCRIPTION descriptionNumber="0.2" primary="NP V NP" secondary="Basic Transitive" xtag="0.2"/>
   <EXAMPLES>
    <EXAMPLE>
     I bullied him.
    </EXAMPLE>
   </EXAMPLES>
   <SYNTAX>
    <NP value="Agent">
     <SELRESTRS/>
    </NP>
    <VERB/>
    <NP value="Patient">
     <SELRESTRS/>
    </NP>
   </SYNTAX>
   <SEMANTICS>
    <PRED value="do">
     <ARGS>
      <ARG type="Event" value="e1"/>
      <ARG type="ThemRole" value="Agent"/>
     </ARGS>
    </PRED>
    <PRED value="manner">
     <ARGS>
      <ARG type="Event" value="e1"/>
      <ARG type="Constant" value="hostile"/>
      <ARG type="ThemRole" value="Agent"/>
     </ARGS>
    </PRED>
    <PRED value="has_emotional_state">
     <ARGS>
      <ARG type="Event" value="e2"/>
      <ARG type="ThemRole" value="Patient"/>
      <ARG type="Constant" value="negative_emotion"/>
     </ARGS>
    </PRED>
    <PRED value="cause">
     <ARGS>
      <ARG type="Event" value="e1"/>
      <ARG type="Event" value="e2"/>
     </ARGS>
    </PRED>
   </SEMANTICS>
  </FRAME>
  <FRAME>
   <DESCRIPTION descriptionNumber="0.2" primary="NP V NP S_ING" secondary="NP-P-ING-OC; into-PP" xtag="0.2"/>
   <EXAMPLES>
    <EXAMPLE>
     I bullied him into coming.
    </EXAMPLE>
   </EXAMPLES>
   <SYNTAX>
    <NP value="Agent">
     <SELRESTRS/>
    </NP>
    <VERB/>
    <NP value="Patient">
     <SELRESTRS/>
    </NP>
    <PREP value="into">
     <SELRESTRS/>
    </PREP>
    <NP value="Eventuality">
     <SELRESTRS>
      <SELRESTR Value="+" type="oc_ing"/>
     </SELRESTRS>
    </NP>
   </SYNTAX>
   <SEMANTICS>
    <PRED value="do">
     <ARGS>
      <ARG type="Event" value="e1"/>
      <ARG type="ThemRole" value="Agent"/>
     </ARGS>
    </PRED>
    <PRED value="manner">
     <ARGS>
      <ARG type="Event" value="e1"/>
      <ARG type="Constant" value="hostile"/>
      <ARG type="ThemRole" value="Agent"/>
     </ARGS>
    </PRED>
    <PRED value="has_emotional_state">
     <ARGS>
      <ARG type="Event" value="e2"/>
      <ARG type="ThemRole" value="Patient"/>
      <ARG type="Constant" value="negative_emotion"/>
     </ARGS>
    </PRED>
    <PRED value="cause">
     <ARGS>
      <ARG type="Event" value="e1"/>
      <ARG type="Event" value="e2"/>
     </ARGS>
    </PRED>
    <PRED value="act">
     <ARGS>
      <ARG type="Event" value="e3"/>
      <ARG type="ThemRole" value="Patient"/>
      <ARG type="ThemRole" value="Result"/>
     </ARGS>
    </PRED>
    <PRED value="cause">
     <ARGS>
      <ARG type="Event" value="e1"/>
      <ARG type="Event" value="e3"/>
     </ARGS>
    </PRED>
   </SEMANTICS>
  </FRAME>
  <FRAME>
   <DESCRIPTION descriptionNumber="0.2" primary="NP V NP PP.result" secondary="NP-PP; into-PP" xtag="0.1"/>
   <EXAMPLES>
    <EXAMPLE>
     I bullied John into the chairmanship.
    </EXAMPLE>
   </EXAMPLES>
   <SYNTAX>
    <NP value="Agent">
     <SELRESTRS/>
    </NP>
    <VERB/>
    <NP value="Patient">
     <SELRESTRS/>
    </NP>
    <PREP value="into">
     <SELRESTRS/>
    </PREP>
    <NP value="Result">
     <SELRESTRS>
      <SELRESTR Value="-" type="sentential"/>
     </SELRESTRS>
    </NP>
   </SYNTAX>
   <SEMANTICS>
    <PRED value="do">
     <ARGS>
      <ARG type="Event" value="e1"/>
      <ARG type="ThemRole" value="Agent"/>
     </ARGS>
    </PRED>
    <PRED value="manner">
     <ARGS>
      <ARG type="Event" value="e1"/>
      <ARG type="Constant" value="hostile"/>
      <ARG type="ThemRole" value="Agent"/>
     </ARGS>
    </PRED>
    <PRED value="has_emotional_state">
     <ARGS>
      <ARG type="Event" value="e2"/>
      <ARG type="ThemRole" value="Patient"/>
      <ARG type="Constant" value="negative_emotion"/>
     </ARGS>
    </PRED>
    <PRED value="cause">
     <ARGS>
      <ARG type="Event" value="e1"/>
      <ARG type="Event" value="e2"/>
     </ARGS>
    </PRED>
    <PRED value="act">
     <ARGS>
      <ARG type="Event" value="e3"/>
      <ARG type="ThemRole" value="Patient"/>
      <ARG type="ThemRole" value="Result"/>
     </ARGS>
    </PRED>
    <PRED value="cause">
     <ARGS>
      <ARG type="Event" value="e1"/>
      <ARG type="Event" value="e3"/>
     </ARGS>
    </PRED>
   </SEMANTICS>
  </FRAME>
 </FRAMES>
 <SUBCLASSES/>
</VNCLASS>