<!DOCTYPE VNCLASS SYSTEM "vn_class-3.dtd">
<VNCLASS ID="see-30.1" xmlns:xsi="http://www.w3.org/2001/XMLSchema-instance" xsi:noNamespaceSchemaLocation="vn_schema-3.xsd">
 <MEMBERS>
  <MEMBER fn_mapping="None" grouping="tell.02" name="can_tell" verbnet_key="can_tell#1" wn="tell%2:31:00 tell%2:31:01" features=""/>
  <MEMBER fn_mapping="None" grouping="smell.01" name="smell" verbnet_key="smell#1" wn="smell%2:39:01" features=""/>
  <MEMBER fn_mapping="Perception_experience" grouping="taste.01 taste.02" name="taste" verbnet_key="taste#2" wn="taste%2:34:00 taste%2:39:00 taste%2:39:01" features=""/>
 </MEMBERS>
 <THEMROLES>
  <THEMROLE type="Experiencer">
   <SELRESTRS>
    <SELRESTR Value="+" type="animate"/>
   </SELRESTRS>
  </THEMROLE>
  <THEMROLE type="Stimulus">
   <SELRESTRS/>
  </THEMROLE>
 </THEMROLES>
 <FRAMES>
  <FRAME>
   <DESCRIPTION descriptionNumber="0.5" primary="NP V that S" secondary="S" xtag=""/>
   <EXAMPLES>
    <EXAMPLE>
     I saw that you were excited.
    </EXAMPLE>
   </EXAMPLES>
   <SYNTAX>
    <NP value="Experiencer">
     <SELRESTRS/>
    </NP>
    <VERB/>
    <NP value="Stimulus">
     <SELRESTRS>
      <SELRESTR Value="+" type="that_comp"/>
     </SELRESTRS>
    </NP>
   </SYNTAX>
   <SEMANTICS>
    <PRED value="perceive">
     <ARGS>
      <ARG type="Event" value="e1"/>
      <ARG type="ThemRole" value="Experiencer"/>
      <ARG type="ThemRole" value="Stimulus"/>
     </ARGS>
    </PRED>
   </SEMANTICS>
  </FRAME>
  <FRAME>
   <DESCRIPTION descriptionNumber="0.2" primary="NP V NP" secondary="Basic Transitive" xtag=""/>
   <EXAMPLES>
    <EXAMPLE>
     I saw the play.
    </EXAMPLE>
   </EXAMPLES>
   <SYNTAX>
    <NP value="Experiencer">
     <SELRESTRS/>
    </NP>
    <VERB/>
    <NP value="Stimulus">
     <SELRESTRS/>
    </NP>
   </SYNTAX>
   <SEMANTICS>
    <PRED value="perceive">
     <ARGS>
      <ARG type="Event" value="e1"/>
      <ARG type="ThemRole" value="Experiencer"/>
      <ARG type="ThemRole" value="Stimulus"/>
     </ARGS>
    </PRED>
   </SEMANTICS>
  </FRAME>
  <FRAME>
   <DESCRIPTION descriptionNumber="2.13.2" primary="NP V NP-ATTR-POS" secondary="Attribute Object Possessor-Attribute Factoring Alternation" xtag=""/>
   <EXAMPLES>
    <EXAMPLE>
     I sensed the eagerness in him.
    </EXAMPLE>
   </EXAMPLES>
   <SYNTAX>
    <NP value="Experiencer">
     <SELRESTRS/>
    </NP>
    <VERB/>
    <NP value="Stimulus">
     <SELRESTRS/>
    </NP>
   </SYNTAX>
   <SEMANTICS>
    <PRED value="perceive">
     <ARGS>
      <ARG type="Event" value="e1"/>
      <ARG type="ThemRole" value="Experiencer"/>
      <ARG type="ThemRole" value="Stimulus"/>
     </ARGS>
    </PRED>
   </SEMANTICS>
  </FRAME>
  <FRAME>
   <DESCRIPTION descriptionNumber="8.1" primary="NP V how S" secondary="HOW-S" xtag="0.2"/>
   <EXAMPLES>
    <EXAMPLE>
     I saw how he arrived.
    </EXAMPLE>
   </EXAMPLES>
   <SYNTAX>
    <NP value="Experiencer">
     <SELRESTRS/>
    </NP>
    <VERB/>
    <NP value="Stimulus">
     <SELRESTRS>
      <SELRESTR Value="+" type="how_extract"/>
     </SELRESTRS>
    </NP>
   </SYNTAX>
   <SEMANTICS>
    <PRED value="perceive">
     <ARGS>
      <ARG type="Event" value="e1"/>
      <ARG type="ThemRole" value="Experiencer"/>
      <ARG type="ThemRole" value="Stimulus"/>
     </ARGS>
    </PRED>
   </SEMANTICS>
  </FRAME>
  <FRAME>
   <DESCRIPTION descriptionNumber="8.1" primary="NP V what S" secondary="WHAT-S" xtag="0.2"/>
   <EXAMPLES>
    <EXAMPLE>
     I saw what they did.
    </EXAMPLE>
   </EXAMPLES>
   <SYNTAX>
    <NP value="Experiencer">
     <SELRESTRS/>
    </NP>
    <VERB/>
    <NP value="Stimulus">
     <SELRESTRS>
      <SELRESTR Value="+" type="what_extract"/>
     </SELRESTRS>
    </NP>
   </SYNTAX>
   <SEMANTICS>
    <PRED value="perceive">
     <ARGS>
      <ARG type="Event" value="e1"/>
      <ARG type="ThemRole" value="Experiencer"/>
      <ARG type="ThemRole" value="Stimulus"/>
     </ARGS>
    </PRED>
   </SEMANTICS>
  </FRAME>
 </FRAMES>
 <SUBCLASSES>
  <VNSUBCLASS ID="see-30.1-1">
   <MEMBERS>
    <MEMBER fn_mapping="None" grouping="detect.01" name="detect" verbnet_key="detect#1" wn="detect%2:39:00" features=""/>
    <MEMBER fn_mapping="None" grouping="" name="discern" verbnet_key="discern#1" wn="discern%2:39:00" features=""/>
    <MEMBER fn_mapping="Perception_experience" grouping="feel.01 feel.02" name="feel" verbnet_key="feel#4" wn="feel%2:31:00 feel%2:39:00 feel%2:29:00 feel%2:35:00" features=""/>
    <MEMBER fn_mapping="None" grouping="sense.01 sense.03" name="sense" verbnet_key="sense#1" wn="sense%2:39:00" features=""/>
    <MEMBER fn_mapping="Perception_experience" grouping="perceive.01" name="perceive" verbnet_key="perceive#2" wn="" features=""/>
    <MEMBER fn_mapping="Becoming_aware" grouping="notice.01" name="notice" verbnet_key="notice#1" wn="notice%2:39:04 notice%2:39:00" features=""/>
    <MEMBER fn_mapping="Perception_experience" grouping="see.01 see.03" name="see" verbnet_key="see#3" wn="see%2:39:00 see%2:39:02 see%2:36:00 see%2:39:03 see%2:32:00 see%2:41:11 see%2:41:12 see%2:41:10 see%2:39:11 see%2:39:13" features=""/>
   </MEMBERS>
   <THEMROLES/>
   <FRAMES>
    <FRAME>
     <DESCRIPTION descriptionNumber="8.1" primary="NP V S" secondary="NP-INF-OC" xtag="0.2"/>
     <EXAMPLES>
      <EXAMPLE>
       I saw her bake the cake.
      </EXAMPLE>
     </EXAMPLES>
     <SYNTAX>
      <NP value="Experiencer">
       <SELRESTRS/>
      </NP>
      <VERB/>
      <NP value="Stimulus">
       <SELRESTRS>
        <SELRESTR Value="+" type="oc_bare_inf"/>
       </SELRESTRS>
      </NP>
     </SYNTAX>
     <SEMANTICS>
      <PRED value="perceive">
       <ARGS>
        <ARG type="Event" value="e1"/>
        <ARG type="ThemRole" value="Experiencer"/>
        <ARG type="ThemRole" value="Stimulus"/>
       </ARGS>
      </PRED>
     </SEMANTICS>
    </FRAME>
    <FRAME>
     <DESCRIPTION descriptionNumber="8.1" primary="NP V S_ING" secondary="NP-ING-OC" xtag="0.2"/>
     <EXAMPLES>
      <EXAMPLE>
       I saw him laughing.
      </EXAMPLE>
     </EXAMPLES>
     <SYNTAX>
      <NP value="Experiencer">
       <SELRESTRS/>
      </NP>
      <VERB/>
      <NP value="Stimulus">
       <SELRESTRS>
        <SELRESTR Value="+" type="oc_ing"/>
       </SELRESTRS>
      </NP>
     </SYNTAX>
     <SEMANTICS>
      <PRED value="perceive">
       <ARGS>
        <ARG type="Event" value="e1"/>
        <ARG type="ThemRole" value="Experiencer"/>
        <ARG type="ThemRole" value="Stimulus"/>
       </ARGS>
      </PRED>
     </SEMANTICS>
    </FRAME>
    <FRAME>
     <DESCRIPTION descriptionNumber="8.1" primary="NP V S_ING" secondary="POSSING" xtag="0.2"/>
     <EXAMPLES>
      <EXAMPLE>
       I saw their laughing and joking.
      </EXAMPLE>
     </EXAMPLES>
     <SYNTAX>
      <NP value="Experiencer">
       <SELRESTRS/>
      </NP>
      <VERB/>
      <NP value="Stimulus">
       <SELRESTRS>
        <SELRESTR Value="+" type="poss_ing"/>
       </SELRESTRS>
      </NP>
     </SYNTAX>
     <SEMANTICS>
      <PRED value="perceive">
       <ARGS>
        <ARG type="Event" value="e1"/>
        <ARG type="ThemRole" value="Experiencer"/>
        <ARG type="ThemRole" value="Stimulus"/>
       </ARGS>
      </PRED>
     </SEMANTICS>
    </FRAME>
   </FRAMES>
   <SUBCLASSES>
    <VNSUBCLASS ID="see-30.1-1-1">
     <MEMBERS>
      <MEMBER fn_mapping="Perception_experience" grouping="hear.01 hear.02" name="hear" verbnet_key="hear#2" wn="hear%2:39:00 hear%2:31:00 hear%2:39:01 hear%2:39:05" features=""/>
     </MEMBERS>
     <THEMROLES/>
     <FRAMES>
      <FRAME>
       <DESCRIPTION descriptionNumber="" primary="NP V PP.stimulus" secondary="PP; Stimulus-PP" xtag=""/>
       <EXAMPLES>
        <EXAMPLE>
         The entire class heard about/of the sermon.
        </EXAMPLE>
       </EXAMPLES>
       <SYNTAX>
        <NP value="Experiencer">
         <SELRESTRS/>
        </NP>
        <VERB/>
        <PREP value="about of">
         <SELRESTRS/>
        </PREP>
        <NP value="Stimulus">
         <SELRESTRS/>
        </NP>
       </SYNTAX>
       <SEMANTICS>
        <PRED value="perceive">
         <ARGS>
          <ARG type="Event" value="e1"/>
          <ARG type="ThemRole" value="Experiencer"/>
          <ARG type="ThemRole" value="Stimulus"/>
         </ARGS>
        </PRED>
       </SEMANTICS>
      </FRAME>
     </FRAMES>
     <SUBCLASSES/>
    </VNSUBCLASS>
   </SUBCLASSES>
  </VNSUBCLASS>
 </SUBCLASSES>
</VNCLASS>