<!DOCTYPE VNCLASS SYSTEM "vn_class-3.dtd">
<VNCLASS ID="supervision-95.2.2" xmlns:xsi="http://www.w3.org/2001/XMLSchema-instance" xsi:noNamespaceSchemaLocation="vn_schema-3.xsd">
 <MEMBERS>
  <MEMBER grouping="" name="boss" verbnet_key="boss#2" wn=""/>
  <MEMBER grouping="direct.01" name="direct" verbnet_key="direct#2" wn="direct%2:32:00"/>
  <MEMBER grouping="lead.04" name="lead" verbnet_key="lead#4" wn=""/>
  <MEMBER grouping="manage.02" name="manage" verbnet_key="manage#3" wn="manage%2:41:00 manage%2:41:01"/>
  <MEMBER grouping="" name="superintend" verbnet_key="superintend#1" wn="superintend%2:41:00"/>
  <MEMBER grouping="supervise.01" name="supervise" verbnet_key="supervise#1" wn="supervise%2:41:00 supervise%2:39:00"/>
 </MEMBERS>
 <THEMROLES>
  <THEMROLE type="Agent">
   <SELRESTRS logic="or">
    <SELRESTR Value="+" type="animate"/>
    <SELRESTR Value="+" type="organization"/>
   </SELRESTRS>
  </THEMROLE>
  <THEMROLE type="Co-Agent">
   <SELRESTRS logic="or">
    <SELRESTR Value="+" type="animate"/>
    <SELRESTR Value="+" type="organization"/>
   </SELRESTRS>
  </THEMROLE>
 </THEMROLES>
 <FRAMES>
  <FRAME>
   <DESCRIPTION descriptionNumber="8.1" primary="NP V NP.agent" secondary="NP-PP" xtag="0.2"/>
   <EXAMPLES>
    <EXAMPLE>
     Martha supervises Kevin.
    </EXAMPLE>
   </EXAMPLES>
   <SYNTAX>
    <NP value="Agent">
     <SYNRESTRS/>
    </NP>
    <VERB/>
    <NP value="Co-Agent">
     <SYNRESTRS/>
    </NP>
   </SYNTAX>
   <SEMANTICS>
    <PRED value="authority_relationship">
     <ARGS>
      <ARG type="ThemRole" value="Agent"/>
      <ARG type="ThemRole" value="Co-Agent"/>
     </ARGS>
    </PRED>
   </SEMANTICS>
  </FRAME>
 </FRAMES>
 <SUBCLASSES/>
</VNCLASS>