<!DOCTYPE VNCLASS SYSTEM "vn_class-3.dtd">
<VNCLASS ID="trick-59.2" xmlns:xsi="http://www.w3.org/2001/XMLSchema-instance" xsi:noNamespaceSchemaLocation="vn_schema-3.xsd">
 <MEMBERS>
  <MEMBER fn_mapping="None" grouping="" name="bamboozle" verbnet_key="bamboozle#1" wn="bamboozle%2:32:00" features=""/>
  <MEMBER fn_mapping="None" grouping="cozen.02" name="cozen" verbnet_key="cozen#2" wn="cozen%2:41:01 cozen%2:41:00" features=""/>
  <MEMBER fn_mapping="None" grouping="" name="fox" verbnet_key="fox#2" wn="fox%2:41:00" features=""/>
  <MEMBER fn_mapping="None" grouping="" name="bullshit" verbnet_key="bullshit#1" wn="bullshit%2:32:00" features=""/>
  <MEMBER fn_mapping="None" grouping="" name="bluff" verbnet_key="bluff#1" wn="bluff%2:33:00 bluff%2:32:00" features=""/>
  <MEMBER fn_mapping="None" grouping="" name="blackmail" verbnet_key="blackmail#1" wn="blackmail%2:41:00 blackmail%2:40:00" features=""/>
  <MEMBER fn_mapping="None" grouping="cheat.02" name="cheat" verbnet_key="cheat#2" wn="cheat%2:33:00" features=""/>
  <MEMBER fn_mapping="None" grouping="con.01" name="con" verbnet_key="con#2" wn="con%2:41:00" features=""/>
  <MEMBER fn_mapping="None" grouping="deceive.01" name="deceive" verbnet_key="deceive#1" wn="deceive%2:32:00" features=""/>
  <MEMBER fn_mapping="None" grouping="" name="delude" verbnet_key="delude#1" wn="delude%2:41:00" features=""/>
  <MEMBER fn_mapping="None" grouping="" name="dupe" verbnet_key="dupe#1" wn="dupe%2:32:00" features=""/>
  <MEMBER fn_mapping="None" grouping="" name="ensnare" verbnet_key="ensnare#1" wn="ensnare%2:41:00" features=""/>
  <MEMBER fn_mapping="None" grouping="" name="entrap" verbnet_key="entrap#1" wn="entrap%2:41:00" features=""/>
  <MEMBER fn_mapping="None" grouping="" name="extort" verbnet_key="extort#2" wn="" features=""/>
  <MEMBER fn_mapping="None" grouping="fool.01" name="fool" verbnet_key="fool#1" wn="fool%2:32:01" features=""/>
  <MEMBER fn_mapping="None" grouping="" name="hoodwink" verbnet_key="hoodwink#1" wn="hoodwink%2:41:00" features=""/>
  <MEMBER fn_mapping="None" grouping="manipulate.01" name="manipulate" verbnet_key="manipulate#1" wn="manipulate%2:41:00 manipulate%2:37:00" features=""/>
  <MEMBER fn_mapping="None" grouping="mislead.01 mislead.02" name="mislead" verbnet_key="mislead#1" wn="mislead%2:32:00" features=""/>
  <MEMBER fn_mapping="None" grouping="" name="trick" verbnet_key="trick#2" wn="trick%2:41:00" features=""/>
  <MEMBER fn_mapping="None" grouping="trap.01" name="trap" verbnet_key="trap#2" wn="trap%2:41:00" features=""/>
 </MEMBERS>
 <THEMROLES>
  <THEMROLE type="Agent">
   <SELRESTRS logic="or">
    <SELRESTR Value="+" type="animate"/>
    <SELRESTR Value="+" type="organization"/>
   </SELRESTRS>
  </THEMROLE>
  <THEMROLE type="Patient">
   <SELRESTRS logic="or">
    <SELRESTR Value="+" type="animate"/>
    <SELRESTR Value="+" type="organization"/>
   </SELRESTRS>
  </THEMROLE>
  <THEMROLE type="Result">
   <SELRESTRS/>
  </THEMROLE>
 </THEMROLES>
 <FRAMES>
  <FRAME>
   <DESCRIPTION descriptionNumber="0.2" primary="NP V NP" secondary="Basic Transitive" xtag="0.2"/>
   <EXAMPLES>
    <EXAMPLE>
     I tricked him.
    </EXAMPLE>
   </EXAMPLES>
   <SYNTAX>
    <NP value="Agent">
     <SELRESTRS/>
    </NP>
    <VERB/>
    <NP value="Patient">
     <SELRESTRS/>
    </NP>
   </SYNTAX>
   <SEMANTICS>
    <PRED value="do">
     <ARGS>
      <ARG type="Event" value="e1"/>
      <ARG type="ThemRole" value="Agent"/>
     </ARGS>
    </PRED>
    <PRED value="manner">
     <ARGS>
      <ARG type="Event" value="e1"/>
      <ARG type="Constant" value="deceptive"/>
      <ARG type="ThemRole" value="Agent"/>
     </ARGS>
    </PRED>
    <PRED value="has_emotional_state">
     <ARGS>
      <ARG type="Event" value="e2"/>
      <ARG type="ThemRole" value="Patient"/>
      <ARG type="Constant" value="deceived"/>
     </ARGS>
    </PRED>
    <PRED value="cause">
     <ARGS>
      <ARG type="Event" value="e1"/>
      <ARG type="Event" value="e2"/>
     </ARGS>
    </PRED>
   </SEMANTICS>
  </FRAME>
  <FRAME>
   <DESCRIPTION descriptionNumber="0.2" primary="NP V NP S_ING" secondary="NP-P-ING-OC; into-PP" xtag="0.2"/>
   <EXAMPLES>
    <EXAMPLE>
     I tricked him into coming.
    </EXAMPLE>
   </EXAMPLES>
   <SYNTAX>
    <NP value="Agent">
     <SELRESTRS/>
    </NP>
    <VERB/>
    <NP value="Patient">
     <SELRESTRS/>
    </NP>
    <PREP value="into">
     <SELRESTRS/>
    </PREP>
    <NP value="Result">
     <SELRESTRS>
      <SELRESTR Value="+" type="oc_ing"/>
     </SELRESTRS>
    </NP>
   </SYNTAX>
   <SEMANTICS>
    <PRED value="do">
     <ARGS>
      <ARG type="Event" value="e1"/>
      <ARG type="ThemRole" value="Agent"/>
     </ARGS>
    </PRED>
    <PRED value="manner">
     <ARGS>
      <ARG type="Event" value="e1"/>
      <ARG type="Constant" value="deceptive"/>
      <ARG type="ThemRole" value="Agent"/>
     </ARGS>
    </PRED>
    <PRED value="has_emotional_state">
     <ARGS>
      <ARG type="Event" value="e2"/>
      <ARG type="ThemRole" value="Patient"/>
      <ARG type="Constant" value="deceived"/>
     </ARGS>
    </PRED>
    <PRED value="cause">
     <ARGS>
      <ARG type="Event" value="e1"/>
      <ARG type="Event" value="e2"/>
     </ARGS>
    </PRED>
    <PRED value="act">
     <ARGS>
      <ARG type="Event" value="e3"/>
      <ARG type="ThemRole" value="Patient"/>
      <ARG type="ThemRole" value="Result"/>
     </ARGS>
    </PRED>
    <PRED value="cause">
     <ARGS>
      <ARG type="Event" value="e1"/>
      <ARG type="Event" value="e3"/>
     </ARGS>
    </PRED>
   </SEMANTICS>
  </FRAME>
  <FRAME>
   <DESCRIPTION descriptionNumber="0.2" primary="NP V NP PP.result" secondary="NP-PP; into-PP" xtag="0.1"/>
   <EXAMPLES>
    <EXAMPLE>
     I tricked John into the chairmanship.
    </EXAMPLE>
   </EXAMPLES>
   <SYNTAX>
    <NP value="Agent">
     <SELRESTRS/>
    </NP>
    <VERB/>
    <NP value="Patient">
     <SELRESTRS/>
    </NP>
    <PREP value="into">
     <SELRESTRS/>
    </PREP>
    <NP value="Result">
     <SELRESTRS>
      <SELRESTR Value="-" type="sentential"/>
     </SELRESTRS>
    </NP>
   </SYNTAX>
   <SEMANTICS>
    <PRED value="do">
     <ARGS>
      <ARG type="Event" value="e1"/>
      <ARG type="ThemRole" value="Agent"/>
     </ARGS>
    </PRED>
    <PRED value="manner">
     <ARGS>
      <ARG type="Event" value="e1"/>
      <ARG type="Constant" value="deceptive"/>
      <ARG type="ThemRole" value="Agent"/>
     </ARGS>
    </PRED>
    <PRED value="has_emotional_state">
     <ARGS>
      <ARG type="Event" value="e2"/>
      <ARG type="ThemRole" value="Patient"/>
      <ARG type="Constant" value="deceived"/>
     </ARGS>
    </PRED>
    <PRED value="cause">
     <ARGS>
      <ARG type="Event" value="e1"/>
      <ARG type="Event" value="e2"/>
     </ARGS>
    </PRED>
    <PRED value="act">
     <ARGS>
      <ARG type="Event" value="e3"/>
      <ARG type="ThemRole" value="Patient"/>
      <ARG type="ThemRole" value="Result"/>
     </ARGS>
    </PRED>
    <PRED value="cause">
     <ARGS>
      <ARG type="Event" value="e1"/>
      <ARG type="Event" value="e3"/>
     </ARGS>
    </PRED>
   </SEMANTICS>
  </FRAME>
 </FRAMES>
 <SUBCLASSES/>
</VNCLASS>