<!DOCTYPE VNCLASS SYSTEM "vn_class-3.dtd">
<VNCLASS ID="complete-55.2" xmlns:xsi="http://www.w3.org/2001/XMLSchema-instance" xsi:noNamespaceSchemaLocation="vn_schema-3.xsd">
 <MEMBERS>
  <MEMBER fn_mapping="Accomplishment" grouping="accomplish.01" name="accomplish" verbnet_key="accomplish#1" wn="accomplish%2:36:00 accomplish%2:41:00" features=""/>
  <MEMBER fn_mapping="Accomplishment" grouping="achieve.01" name="achieve" verbnet_key="achieve#1" wn="achieve%2:41:00" features=""/>
  <MEMBER fn_mapping="None" grouping="bring.08" name="bring-off" verbnet_key="bring-off#1" wn="" features=""/>
  <MEMBER fn_mapping="None" grouping="complete.01 complete.02 complete.03" name="complete" verbnet_key="complete#1" wn="complete%2:30:02 complete%2:30:00 complete%2:41:00" features=""/>
  <MEMBER fn_mapping="None" grouping="pull.04" name="pull-off" verbnet_key="pull-off#1" wn="" features=""/>
 </MEMBERS>
 <THEMROLES>
  <THEMROLE type="Agent">
   <SELRESTRS logic="or">
    <SELRESTR Value="+" type="animate"/>
    <SELRESTR Value="+" type="organization"/>
   </SELRESTRS>
  </THEMROLE>
  <THEMROLE type="Eventuality">
   <SELRESTRS/>
  </THEMROLE>
 </THEMROLES>
 <FRAMES>
  <FRAME>
   <DESCRIPTION descriptionNumber="0.2" primary="NP V NP" secondary="Basic Transitive" xtag=""/>
   <EXAMPLES>
    <EXAMPLE>
     Wilma completed the assignment.
    </EXAMPLE>
   </EXAMPLES>
   <SYNTAX>
    <NP value="Agent">
     <SELRESTRS/>
    </NP>
    <VERB/>
    <NP value="Eventuality">
     <SELRESTRS/>
    </NP>
   </SYNTAX>
   <SEMANTICS>
    <PRED value="engage_in">
     <ARGS>
      <ARG type="Event" value="ë1"/>
      <ARG type="ThemRole" value="Agent"/>
      <ARG type="ThemRole" value="Eventuality"/>
     </ARGS>
    </PRED>
    <PRED value="completed">
     <ARGS>
      <ARG type="Event" value="e2"/>
      <ARG type="ThemRole" value="Eventuality"/>
     </ARGS>
    </PRED>
   </SEMANTICS>
  </FRAME>
  <FRAME>
   <DESCRIPTION descriptionNumber="8.1" primary="NP V S_ING" secondary="ING-SC/BE-ING-SC" xtag="0.2"/>
   <EXAMPLES>
    <EXAMPLE>
     She completed running the race.
    </EXAMPLE>
   </EXAMPLES>
   <SYNTAX>
    <NP value="Agent">
     <SELRESTRS/>
    </NP>
    <VERB/>
    <NP value="Eventuality">
     <SELRESTRS>
      <SELRESTR Value="+" type="be_sc_ing"/>
     </SELRESTRS>
    </NP>
   </SYNTAX>
   <SEMANTICS>
    <PRED value="engage_in">
     <ARGS>
      <ARG type="Event" value="ë1"/>
      <ARG type="ThemRole" value="Agent"/>
      <ARG type="ThemRole" value="Eventuality"/>
     </ARGS>
    </PRED>
    <PRED value="completed">
     <ARGS>
      <ARG type="Event" value="e2"/>
      <ARG type="ThemRole" value="Eventuality"/>
     </ARGS>
    </PRED>
   </SEMANTICS>
  </FRAME>
 </FRAMES>
 <SUBCLASSES/>
</VNCLASS>