<!DOCTYPE VNCLASS SYSTEM "vn_class-3.dtd">
<VNCLASS ID="coil-9.6" xmlns:xsi="http://www.w3.org/2001/XMLSchema-instance" xsi:noNamespaceSchemaLocation="vn_schema-3.xsd">
 <MEMBERS>
  <MEMBER fn_mapping="None" grouping="loop.02" name="loop" verbnet_key="loop#1" wn="loop%2:36:00 loop%2:35:00" features=""/>
  <MEMBER fn_mapping="Reshaping" grouping="roll.02" name="roll" verbnet_key="roll#3" wn="roll%2:35:00" features=""/>
  <MEMBER fn_mapping="Moving_in_place" grouping="rotate.01" name="rotate" verbnet_key="rotate#1" wn="rotate%2:38:01" features=""/>
  <MEMBER fn_mapping="Perception_body" grouping="spin.01" name="spin" verbnet_key="spin#2" wn="spin%2:38:02" features=""/>
  <MEMBER fn_mapping="None" grouping="" name="swirl" verbnet_key="swirl#1" wn="swirl%2:38:01" features=""/>
  <MEMBER fn_mapping="None" grouping="" name="twine" verbnet_key="twine#1" wn="twine%2:35:03" features=""/>
  <MEMBER fn_mapping="None" grouping="" name="whirl" verbnet_key="whirl#1" wn="whirl%2:38:02" features=""/>
  <MEMBER fn_mapping="Motion" grouping="wind.02" name="wind" verbnet_key="wind#1" wn="wind%2:35:06" features=""/>
 </MEMBERS>
 <THEMROLES>
  <THEMROLE type="Agent">
   <SELRESTRS>
    <SELRESTR Value="+" type="int_control"/>
   </SELRESTRS>
  </THEMROLE>
  <THEMROLE type="Theme">
   <SELRESTRS>
    <SELRESTR Value="+" type="nonrigid"/>
    <SELRESTR Value="+" type="elongated"/>
   </SELRESTRS>
  </THEMROLE>
  <THEMROLE type="Initial_Location">
   <SELRESTRS>
    <SELRESTR Value="+" type="location"/>
   </SELRESTRS>
  </THEMROLE>
  <THEMROLE type="Destination">
   <SELRESTRS>
    <SELRESTR Value="+" type="location"/>
   </SELRESTRS>
  </THEMROLE>
  <THEMROLE type="Axis">
   <SELRESTRS/>
  </THEMROLE>
 </THEMROLES>
 <FRAMES>
  <FRAME>
   <DESCRIPTION descriptionNumber="0.2" primary="NP V NP PP.location" secondary="NP-PP; path-PP" xtag=""/>
   <EXAMPLES>
    <EXAMPLE>
     Cora coiled the rope around the post.
    </EXAMPLE>
   </EXAMPLES>
   <SYNTAX>
    <NP value="Agent">
     <SELRESTRS/>
    </NP>
    <VERB/>
    <NP value="Theme">
     <SELRESTRS/>
    </NP>
    <PREP>
     <SELRESTRS>
      <SELRESTR Value="+" type="path"/>
     </SELRESTRS>
    </PREP>
    <NP value="Destination">
     <SELRESTRS/>
    </NP>
   </SYNTAX>
   <SEMANTICS>
    <PRED bool="!" value="has_physical_form">
     <ARGS>
      <ARG type="Event" value="e1"/>
      <ARG type="ThemRole" value="Theme"/>
      <ARG type="VerbSpecific" value="V_Form"/>
     </ARGS>
    </PRED>
    <PRED value="has_location">
     <ARGS>
      <ARG type="Event" value="e1"/>
      <ARG type="ThemRole" value="Theme"/>
      <ARG type="ThemRole" value="?Initial_Location"/>
     </ARGS>
    </PRED>
    <PRED value="do">
     <ARGS>
      <ARG type="Event" value="e2"/>
      <ARG type="ThemRole" value="Agent"/>
     </ARGS>
    </PRED>
    <PRED value="motion">
     <ARGS>
      <ARG type="Event" value="ë3"/>
      <ARG type="ThemRole" value="Theme"/>
      <ARG type="PredSpecific" value="Trajectory"/>
     </ARGS>
    </PRED>
    <PRED value="elliptical_motion">
     <ARGS>
      <ARG type="Event" value="ë3"/>
      <ARG type="ThemRole" value="Theme"/>
      <ARG type="ThemRole" value="Axis"/>
     </ARGS>
    </PRED>
    <PRED value="has_physical_form">
     <ARGS>
      <ARG type="Event" value="e4"/>
      <ARG type="ThemRole" value="Theme"/>
      <ARG type="VerbSpecific" value="V_Form"/>
     </ARGS>
    </PRED>
    <PRED value="has_location">
     <ARGS>
      <ARG type="Event" value="e4"/>
      <ARG type="ThemRole" value="Theme"/>
      <ARG type="ThemRole" value="Destination"/>
     </ARGS>
    </PRED>
    <PRED value="cause">
     <ARGS>
      <ARG type="Event" value="e2"/>
      <ARG type="Event" value="ë3"/>
     </ARGS>
    </PRED>
    <PRED value="equals">
     <ARGS>
      <ARG type="ThemRole" value="Destination"/>
      <ARG type="ThemRole" value="Axis"/>
     </ARGS>
    </PRED>
    <PRED value="equals">
     <ARGS>
      <ARG type="ThemRole" value="Destination"/>
      <ARG type="PredSpecific" value="Trajectory"/>
     </ARGS>
    </PRED>
   </SEMANTICS>
  </FRAME>
  <FRAME>
   <DESCRIPTION descriptionNumber="0.1" primary="NP V PP.location" secondary="PP; path-PP" xtag=""/>
   <!--strongly prefers prep "around"-->
   <EXAMPLES>
    <EXAMPLE>
     The rope coiled around the post.
    </EXAMPLE>
   </EXAMPLES>
   <SYNTAX>
    <NP value="Theme">
     <SELRESTRS/>
    </NP>
    <VERB/>
    <PREP>
     <SELRESTRS>
      <SELRESTR Value="+" type="path"/>
     </SELRESTRS>
    </PREP>
    <NP value="Destination">
     <SELRESTRS/>
    </NP>
   </SYNTAX>
   <SEMANTICS>
    <PRED bool="!" value="has_physical_form">
     <ARGS>
      <ARG type="Event" value="e1"/>
      <ARG type="ThemRole" value="Theme"/>
      <ARG type="VerbSpecific" value="V_Form"/>
     </ARGS>
    </PRED>
    <PRED value="has_location">
     <ARGS>
      <ARG type="Event" value="e1"/>
      <ARG type="ThemRole" value="Theme"/>
      <ARG type="ThemRole" value="?Initial_Location"/>
     </ARGS>
    </PRED>
    <PRED value="motion">
     <ARGS>
      <ARG type="Event" value="ë2"/>
      <ARG type="ThemRole" value="Theme"/>
      <ARG type="PredSpecific" value="Trajectory"/>
     </ARGS>
    </PRED>
    <PRED value="elliptical_motion">
     <ARGS>
      <ARG type="Event" value="ë2"/>
      <ARG type="ThemRole" value="Theme"/>
      <ARG type="ThemRole" value="Axis"/>
     </ARGS>
    </PRED>
    <PRED value="has_physical_form">
     <ARGS>
      <ARG type="Event" value="e3"/>
      <ARG type="ThemRole" value="Theme"/>
      <ARG type="VerbSpecific" value="V_Form"/>
     </ARGS>
    </PRED>
    <PRED value="has_location">
     <ARGS>
      <ARG type="Event" value="e3"/>
      <ARG type="ThemRole" value="Theme"/>
      <ARG type="ThemRole" value="Destination"/>
     </ARGS>
    </PRED>
    <PRED value="equals">
     <ARGS>
      <ARG type="ThemRole" value="Destination"/>
      <ARG type="ThemRole" value="Axis"/>
     </ARGS>
    </PRED>
    <PRED value="equals">
     <ARGS>
      <ARG type="ThemRole" value="Destination"/>
      <ARG type="PredSpecific" value="Trajectory"/>
     </ARGS>
    </PRED>
   </SEMANTICS>
  </FRAME>
  <FRAME>
   <DESCRIPTION descriptionNumber="1.1.1" primary="NP V ADV-Middle PP.location" secondary="Middle Construction" xtag=""/>
   <EXAMPLES>
    <EXAMPLE>
     That type of rope coiled easily around the post.
    </EXAMPLE>
   </EXAMPLES>
   <SYNTAX>
    <NP value="Theme">
     <SELRESTRS/>
    </NP>
    <VERB/>
    <ADV/>
    <PREP>
     <SELRESTRS>
      <SELRESTR Value="+" type="path"/>
     </SELRESTRS>
    </PREP>
    <NP value="Destination">
     <SELRESTRS/>
    </NP>
   </SYNTAX>
   <SEMANTICS>
    <PRED bool="!" value="has_physical_form">
     <ARGS>
      <ARG type="Event" value="e1"/>
      <ARG type="ThemRole" value="Theme"/>
      <ARG type="VerbSpecific" value="V_Form"/>
     </ARGS>
    </PRED>
    <PRED value="has_location">
     <ARGS>
      <ARG type="Event" value="e1"/>
      <ARG type="ThemRole" value="Theme"/>
      <ARG type="ThemRole" value="?Initial_Location"/>
     </ARGS>
    </PRED>
    <PRED value="motion">
     <ARGS>
      <ARG type="Event" value="ë2"/>
      <ARG type="ThemRole" value="Theme"/>
      <ARG type="PredSpecific" value="Trajectory"/>
     </ARGS>
    </PRED>
    <PRED value="elliptical_motion">
     <ARGS>
      <ARG type="Event" value="ë2"/>
      <ARG type="ThemRole" value="Theme"/>
      <ARG type="ThemRole" value="Axis"/>
     </ARGS>
    </PRED>
    <PRED value="has_physical_form">
     <ARGS>
      <ARG type="Event" value="e3"/>
      <ARG type="ThemRole" value="Theme"/>
      <ARG type="VerbSpecific" value="V_Form"/>
     </ARGS>
    </PRED>
    <PRED value="has_location">
     <ARGS>
      <ARG type="Event" value="e3"/>
      <ARG type="ThemRole" value="Theme"/>
      <ARG type="ThemRole" value="Destination"/>
     </ARGS>
    </PRED>
    <PRED value="equals">
     <ARGS>
      <ARG type="ThemRole" value="Destination"/>
      <ARG type="ThemRole" value="Axis"/>
     </ARGS>
    </PRED>
    <PRED value="equals">
     <ARGS>
      <ARG type="ThemRole" value="Destination"/>
      <ARG type="PredSpecific" value="Trajectory"/>
     </ARGS>
    </PRED>
   </SEMANTICS>
  </FRAME>
 </FRAMES>
 <SUBCLASSES>
  <VNSUBCLASS ID="coil-9.6-1">
   <MEMBERS>
    <MEMBER fn_mapping="Hair_configuration" grouping="curl.01" name="curl" verbnet_key="curl#2" wn="curl%2:38:00 curl%2:35:01 curl%2:35:00" features=""/>
    <MEMBER fn_mapping="None" grouping="" name="coil" verbnet_key="coil#1" wn="coil%2:35:00" features=""/>
    <MEMBER fn_mapping="Attaching" grouping="hook.01" name="hook" verbnet_key="hook#1" wn="" features=""/>
    <MEMBER fn_mapping="Cause_to_move_in_place" grouping="swing.01" name="swing" verbnet_key="swing#2" wn="swing%2:38:02 swing%2:38:03" features=""/>
    <MEMBER fn_mapping="None" grouping="" name="twirl" verbnet_key="twirl#1" wn="twirl%2:38:01" features=""/>
    <MEMBER fn_mapping="None" grouping="twist.02" name="twist" verbnet_key="twist#1" wn="twist%2:30:00" features=""/>
   </MEMBERS>
   <THEMROLES/>
   <FRAMES>
    <FRAME>
     <DESCRIPTION descriptionNumber="" primary="NP V ADV-Middle" secondary="Middle Construction" xtag=""/>
     <EXAMPLES>
      <EXAMPLE>
       The rope curled upward.
      </EXAMPLE>
     </EXAMPLES>
     <SYNTAX>
      <NP value="Theme">
       <SELRESTRS/>
      </NP>
      <VERB/>
      <ADV value="Trajectory">
       <SELRESTRS/>
      </ADV>
     </SYNTAX>
     <SEMANTICS>
      <PRED value="has_physical_form">
       <ARGS>
        <ARG type="Event" value="E"/>
        <ARG type="ThemRole" value="Theme"/>
        <ARG type="VerbSpecific" value="V_Form"/>
       </ARGS>
      </PRED>
      <PRED value="fictive_motion">
       <ARGS>
        <ARG type="Event" value="E" />
        <ARG type="ThemRole" value="Theme" />
        <ARG type="PredSpecific" value="Trajectory" />
       </ARGS>
      </PRED>
     </SEMANTICS>
    </FRAME>
   </FRAMES>
   <SUBCLASSES/>
  </VNSUBCLASS>
 </SUBCLASSES>
</VNCLASS>